{
  "schema": "roados-native-capabilities-v1",
  "version": "1.0.0",
  "surfaces": {
    "search": ["search-index", "search-intelligence", "analytics"],
    "chat": ["email", "messages", "meetings"],
    "code": ["source", "models", "agents", "apps", "skills"],
    "work": ["tasks", "briefs", "tables", "forms", "calendar", "contacts", "crm", "agreements", "billing", "accounting", "markets", "calculations", "compliance"],
    "play": ["voice", "music", "companions"],
    "design": ["sites", "design-system", "diagrams", "content"],
    "integrate": ["connectors", "deploy", "compute", "edge", "domains", "data", "identity", "consent", "vault", "webhooks", "automation", "observability", "security", "telecom", "remote-control", "chain-data", "mesh"],
    "collaborate": ["projects", "knowledge", "knowledge-graph", "files", "decisions"]
  },
  "capabilities": {
    "search-index": {"surface": "search", "label": "Search", "operations": ["read", "write"], "state": "contracted"},
    "search-intelligence": {"surface": "search", "label": "Search Intelligence", "operations": ["read"], "state": "contracted"},
    "analytics": {"surface": "search", "label": "Analytics", "operations": ["read"], "state": "contracted"},
    "email": {"surface": "chat", "label": "Email", "operations": ["read", "write"], "state": "contracted"},
    "messages": {"surface": "chat", "label": "Messages", "operations": ["read", "write"], "state": "contracted"},
    "meetings": {"surface": "chat", "label": "Meetings", "operations": ["read", "write"], "state": "contracted"},
    "source": {"surface": "code", "label": "Source", "operations": ["read", "write"], "state": "contracted"},
    "models": {"surface": "code", "label": "Models", "operations": ["read", "write"], "state": "contracted"},
    "agents": {"surface": "code", "label": "Agents", "operations": ["read", "write"], "state": "contracted"},
    "apps": {"surface": "code", "label": "Apps", "operations": ["read", "write"], "state": "contracted"},
    "skills": {"surface": "code", "label": "Skills", "operations": ["read", "write"], "state": "contracted"},
    "tasks": {"surface": "work", "label": "Tasks", "operations": ["read", "write"], "state": "contracted"},
    "briefs": {"surface": "work", "label": "Briefs", "operations": ["read", "write"], "state": "contracted"},
    "tables": {"surface": "work", "label": "Tables", "operations": ["read", "write"], "state": "contracted"},
    "forms": {"surface": "work", "label": "Forms", "operations": ["read", "write"], "state": "contracted"},
    "calendar": {"surface": "work", "label": "Calendar", "operations": ["read", "write"], "state": "contracted"},
    "contacts": {"surface": "work", "label": "Contacts", "operations": ["read", "write"], "state": "contracted"},
    "crm": {"surface": "work", "label": "Sales and Service", "operations": ["read", "write"], "state": "contracted"},
    "agreements": {"surface": "work", "label": "Agreements", "operations": ["read", "write"], "state": "contracted"},
    "billing": {"surface": "work", "label": "Billing", "operations": ["read", "write"], "state": "contracted"},
    "accounting": {"surface": "work", "label": "Accounting", "operations": ["read", "write"], "state": "contracted"},
    "markets": {"surface": "work", "label": "Markets", "operations": ["read", "write"], "state": "contracted"},
    "calculations": {"surface": "work", "label": "Calculations", "operations": ["read", "write"], "state": "contracted"},
    "compliance": {"surface": "work", "label": "Compliance", "operations": ["read", "write"], "state": "contracted"},
    "voice": {"surface": "play", "label": "Voice", "operations": ["read", "write"], "state": "contracted"},
    "music": {"surface": "play", "label": "Music", "operations": ["read", "write"], "state": "contracted"},
    "companions": {"surface": "play", "label": "Companions", "operations": ["read", "write"], "state": "contracted"},
    "sites": {"surface": "design", "label": "Sites", "operations": ["read", "write"], "state": "contracted"},
    "design-system": {"surface": "design", "label": "Design", "operations": ["read", "write"], "state": "contracted"},
    "diagrams": {"surface": "design", "label": "Diagrams", "operations": ["read", "write"], "state": "contracted"},
    "content": {"surface": "design", "label": "Content", "operations": ["read", "write"], "state": "contracted"},
    "connectors": {"surface": "integrate", "label": "Integrate", "operations": ["read", "write"], "state": "verified"},
    "deploy": {"surface": "integrate", "label": "Deploy", "operations": ["read", "write"], "state": "contracted"},
    "compute": {"surface": "integrate", "label": "Compute", "operations": ["read", "write"], "state": "contracted"},
    "edge": {"surface": "integrate", "label": "Edge", "operations": ["read", "write"], "state": "contracted"},
    "domains": {"surface": "integrate", "label": "Domains", "operations": ["read", "write"], "state": "contracted"},
    "data": {"surface": "integrate", "label": "Data", "operations": ["read", "write"], "state": "contracted"},
    "identity": {"surface": "integrate", "label": "Identity", "operations": ["read", "write"], "state": "contracted"},
    "consent": {"surface": "integrate", "label": "Consent", "operations": ["read", "write"], "state": "contracted"},
    "vault": {"surface": "integrate", "label": "Vault", "operations": ["read", "write"], "state": "contracted"},
    "webhooks": {"surface": "integrate", "label": "Webhooks", "operations": ["read", "write"], "state": "contracted"},
    "automation": {"surface": "integrate", "label": "Automation", "operations": ["read", "write"], "state": "contracted"},
    "observability": {"surface": "integrate", "label": "Observe", "operations": ["read"], "state": "contracted"},
    "security": {"surface": "integrate", "label": "Security", "operations": ["read", "write"], "state": "contracted"},
    "telecom": {"surface": "integrate", "label": "Telecom", "operations": ["read", "write"], "state": "contracted"},
    "remote-control": {"surface": "integrate", "label": "Remote Control", "operations": ["read", "write"], "state": "contracted"},
    "chain-data": {"surface": "integrate", "label": "Chain Data", "operations": ["read", "write"], "state": "contracted"},
    "mesh": {"surface": "integrate", "label": "Mesh", "operations": ["read", "write"], "state": "contracted"},
    "projects": {"surface": "collaborate", "label": "Projects", "operations": ["read", "write"], "state": "contracted"},
    "knowledge": {"surface": "collaborate", "label": "Knowledge", "operations": ["read", "write"], "state": "contracted"},
    "knowledge-graph": {"surface": "collaborate", "label": "Knowledge Graph", "operations": ["read", "write"], "state": "contracted"},
    "files": {"surface": "collaborate", "label": "Files", "operations": ["read", "write"], "state": "contracted"},
    "decisions": {"surface": "collaborate", "label": "Decisions", "operations": ["read", "write"], "state": "contracted"}
  },
  "bridges": {
    "1password": "vault",
    "adapter-plane": "connectors",
    "airtable": "tables",
    "amplitude": "analytics",
    "appdeploy": "deploy",
    "asana": "tasks",
    "base44": "apps",
    "blackroad-ai-gateway": "agents",
    "calendly": "calendar",
    "cloudflare": "edge",
    "collaboration": "projects",
    "dataverse": "data",
    "digitalocean-codex-infinity": "compute",
    "digitalocean-shellfish": "compute",
    "docusign": "agreements",
    "figma": "design-system",
    "fireflies": "meetings",
    "gitbook": "knowledge",
    "github": "source",
    "gmail": "email",
    "godaddy": "domains",
    "google-calendar": "calendar",
    "google-drive": "files",
    "granola": "meetings",
    "gsc-wizard": "search-intelligence",
    "hugging-face": "models",
    "jotform": "forms",
    "linear": "tasks",
    "meetgeek": "meetings",
    "microsoft-sharepoint": "files",
    "netlify-network-atlas": "deploy",
    "neura-relay": "decisions",
    "notion": "knowledge",
    "nvidia": "models",
    "openai-platform": "models",
    "outlook-email": "email",
    "pandadoc": "agreements",
    "plugin-registry": "connectors",
    "posthog": "analytics",
    "proxyman": "observability",
    "quicknode": "chain-data",
    "railway-api": "deploy",
    "railway-cloud": "deploy",
    "railway-core": "deploy",
    "railway-orchestrator": "automation",
    "railway-roadie": "agents",
    "resend": "email",
    "retell-ai": "voice",
    "search": "search-index",
    "semrush": "search-intelligence",
    "skill-registry": "skills",
    "slack": "messages",
    "stripe": "billing",
    "supabase": "data",
    "tailscale-aperture": "observability",
    "tailscale-services": "mesh",
    "vercel-context-bridge": "deploy",
    "vercel-infra": "deploy",
    "webflow": "sites",
    "webhook-gateway": "webhooks",
    "windsor-ai": "analytics",
    "workos": "identity",
    "zoho-crm": "crm",
    "zoom": "meetings",
    "zzzops": "automation"
  },
  "exitGate": {
    "baseRequirements": ["owned-storage", "provider-neutral-import", "provider-neutral-export", "provider-disconnect", "rollback-tested", "operation-receipts"],
    "operationRequirements": {"read": "local-read", "write": "local-write"}
  },
  "invariants": [
    "external-providers-are-bridges-not-native-products",
    "every-bridge-has-one-native-destination",
    "native-preference-requires-fresh-exit-evidence",
    "disconnect-never-deletes-owned-data",
    "secrets-never-enter-capability-registry"
  ]
}
